{
  "$schema": "https://json-schema.org/draft/2020-12/schema",
  "title": "spawn_palette",
  "description": "The `spawn_palette` content kind (megaplan 1.7 and task 8-A1): one entry of the Overlord's spawn palette (and of the Server Heat squads, which name entries of this kind). One entry per file; an entry is one spawn action: `count` figures (1 to 8, the `n` of the `spawn` message) at one spot, for `cost` Threat Points, so a bigger spawn is a dearer entry. `group` files the entry under a tab of the palette (gang, law, machine, monster). `hostile` is true when the spawned figures attack players. `kind` is `minecraft` (a vanilla mob, `mob` is its entity id) or `night_city` (a figure of the host's own game, spawned through the `spawn` message of Phase 0 (d): `rec` is its class, `faction` the attitude group it joins). A Night City entry also has `squad`, the Minecraft squad that stands in for it when it cannot be spawned there: for a Minecraft-only player, for a host whose `spawns` toggle is off, or when the Phase 0 (d) spawn does not work (the written fallback). `rec` is one of the classes of the megaplan 1.9 `spawn` row: ganger, ncpd, maxtac and drone (turrets cannot be spawned in the host's game, Phase 0 (d): a turret entry is a `minecraft` entry). `faction` is a game attitude group name (tygerClaws, maelstrom, valentinos, 6thStreet, animals, voodooBoys, scavenger, wraiths, kurtz_army, police, arasaka). The wire carries only the class and the faction, so the NCPD patrol and the enforcers are the same Night City class (the enforcers are a dearer squad with a tougher Minecraft stand-in). `cooldown_s` is how long before the same entry can be spawned again. Text is original. A file with the same id as a default replaces it.",
  "$defs": {
    "mob": {
      "type": "string",
      "pattern": "^[a-z0-9_.-]+:[a-z0-9_./-]+$",
      "maxBytes": 128
    }
  },
  "type": "object",
  "required": [
    "schema",
    "name",
    "description",
    "group",
    "kind",
    "cost",
    "count",
    "hostile"
  ],
  "additionalProperties": false,
  "properties": {
    "schema": {
      "const": 1
    },
    "id": {
      "type": "string",
      "pattern": "^[a-z0-9_.-]+:[a-z0-9_./-]+$",
      "maxBytes": 128
    },
    "name": {
      "type": "string",
      "minLength": 1,
      "maxBytes": 48
    },
    "description": {
      "type": "string",
      "minLength": 1,
      "maxBytes": 200
    },
    "group": {
      "enum": ["gang", "law", "machine", "monster"]
    },
    "kind": {
      "enum": ["minecraft", "night_city"]
    },
    "cost": {
      "type": "integer",
      "minimum": 1,
      "maximum": 60
    },
    "count": {
      "type": "integer",
      "minimum": 1,
      "maximum": 8
    },
    "hostile": {
      "type": "boolean"
    },
    "cooldown_s": {
      "type": "integer",
      "minimum": 0,
      "maximum": 300
    },
    "mob": {
      "$ref": "#/$defs/mob"
    },
    "rec": {
      "enum": ["ganger", "ncpd", "maxtac", "drone"]
    },
    "faction": {
      "type": "string",
      "pattern": "^[A-Za-z0-9_]+$",
      "minLength": 1,
      "maxBytes": 32
    },
    "squad": {
      "type": "object",
      "required": ["mob", "count"],
      "additionalProperties": false,
      "properties": {
        "mob": {"$ref": "#/$defs/mob"},
        "count": {"type": "integer", "minimum": 1, "maximum": 8}
      }
    }
  },
  "oneOf": [
    {
      "required": ["kind", "mob"],
      "properties": {
        "kind": {"const": "minecraft"},
        "rec": false,
        "faction": false,
        "squad": false
      }
    },
    {
      "required": ["kind", "rec", "faction", "squad"],
      "properties": {
        "kind": {"const": "night_city"},
        "mob": false
      }
    }
  ]
}
